{
  "$schema": "http://json-schema.org/draft-07/schema#",
  "type": "object",
  "properties": {
    "meta": {
      "type": "object",
      "properties": {
        "document_type": { "type": "string", "enum": ["ameax_organization_account"] },
        "schema_version": { "type": "string" },
        "import_mode": {
          "type": ["string", "null"],
          "enum": ["create_or_update", "create_only", "update_only", null],
          "default": "create_or_update",
          "description": "Controls how records are processed during import. Defaults to create_or_update if not specified."
        },
        "import_status": {
          "type": "object",
          "additionalProperties": true
        }
      },
      "required": ["document_type", "schema_version"]
    },
    "name": { "type": "string" },
    "additional_name": { "type": ["string", "null"] },
    "identifiers": {
      "type": "object",
      "properties": {
        "customer_number": { "type": ["string", "integer"] },
        "external_id": { "type": ["string", "integer", "null"] },
        "ameax_internal_id": { "type": ["integer", "null"] }
      }
    },
    "address": {
      "type": "object",
      "properties": {
        "route": { "type": ["string", "null"] },
        "house_number": { "type": ["string", "null"] },
        "postal_code": { "type": "string" },
        "locality": { "type": "string" },
        "country": { "type": "string", "pattern": "^[A-Z]{2}$" }
      },
      "required": ["postal_code", "locality", "country"]
    },
    "social_media": {
      "type": ["object", "null"],
      "properties": {
        "web": { "type": ["string", "null"] }
      }
    },
    "communications": {
      "type": ["object", "null"],
      "properties": {
        "phone_number": { "type": ["string", "null"] },
        "phone_number2": { "type": ["string", "null"] },
        "mobile_phone": { "type": ["string", "null"] },
        "email": { "type": ["string", "null"], "format": "email" },
        "fax": { "type": ["string", "null"] }
      }
    },
    "business_information": {
      "type": ["object", "null"],
      "properties": {
        "vat_id": { "type": ["string", "null"] },
        "iban": { "type": ["string", "null"] }
      }
    },
    "agent": {
      "type": ["object", "null"],
      "properties": {
        "external_id": { "type": ["string", "integer", "null"] }
      }
    },
    "custom_data": {
      "type": ["object", "null"],
      "additionalProperties": true
    },
    "contacts": {
      "type": ["array", "null"],
      "items": {
        "type": "object",
        "properties": {
          "salutation": { "type": ["string", "null"], "enum": ["Mr.", "Ms.", "Mx.", null] },
          "honorifics": { "type": ["string", "null"] },
          "firstname": { "type": "string" },
          "lastname": { "type": "string" },
          "identifiers": {
            "type": "object",
            "properties": {
              "external_id": { "type": ["string", "null"] },
              "ameax_internal_id": { "type": ["integer", "null"] }
            }
          },
          "date_of_birth": { "type": ["string", "null"], "format": "date" },
          "employment": {
            "type": "object",
            "properties": {
              "job_title": { "type": ["string", "null"] },
              "department": { "type": ["string", "null"] }
            }
          },
          "communications": {
            "type": ["object", "null"],
            "properties": {
              "phone_number": { "type": ["string", "null"] },
              "phone_number2": { "type": ["string", "null"] },
              "mobile_phone": { "type": ["string", "null"] },
              "email": { "type": ["string", "null"], "format": "email" },
              "fax": { "type": ["string", "null"] }
            }
          },
          "custom_data": {
            "type": ["object", "null"],
            "additionalProperties": true
          }
        },
        "required": ["firstname", "lastname"]
      }
    }
  },
  "required": ["meta", "name", "identifiers", "address"]
}
